[
  {
    "id": "product-ralleh-brain",
    "type": "product",
    "name": "Ralleh BRAIN",
    "summary": "Central context system that assembles compact, cited, and secure context packets.",
    "owner": "orchestrator",
    "source": "BRAIN_AGENT_DEVELOPMENT.md",
    "last_verified_at": "2026-07-23T00:00:00Z",
    "classification": "internal",
    "confidence": 0.9,
    "tags": ["active", "core"],
    "related": ["client-acme"],
    "stale": false,
    "missing_fields": []
  },
  {
    "id": "product-vault",
    "type": "product",
    "name": "Ralleh Vault",
    "summary": "Knowledge crystallization subsystem for durable source-cited memory.",
    "owner": "vault",
    "source": "ralleh-vault/README.md",
    "last_verified_at": "2026-07-23T00:00:00Z",
    "classification": "internal",
    "confidence": 0.84,
    "tags": ["knowledge", "active"],
    "related": [],
    "stale": false,
    "missing_fields": ["roadmap_status"]
  },
  {
    "id": "product-sales-channel-manager",
    "type": "product",
    "name": "Sales Channel Manager",
    "summary": "Sales workflow and channel orchestration system in active workspace development.",
    "owner": "orchestrator",
    "source": "sales-channel-manager/package.json",
    "last_verified_at": "2026-07-23T00:00:00Z",
    "classification": "internal",
    "confidence": 0.7,
    "tags": ["sales", "ops"],
    "related": [],
    "stale": false,
    "missing_fields": ["current_milestone"]
  },
  {
    "id": "product-client-intel-notes",
    "type": "product",
    "name": "Client Intel Notes",
    "summary": "Contains commercially sensitive but shareable internal summaries.",
    "owner": "orchestrator",
    "source": "roles/brain/data/entities/products.json",
    "last_verified_at": "2026-07-23T00:00:00Z",
    "classification": "confidential",
    "confidence": 0.58,
    "tags": ["intel", "client"],
    "related": ["client-acme"],
    "stale": false,
    "missing_fields": ["latest_snapshot_at"]
  },
  {
    "id": "product-vault-keys",
    "type": "product",
    "name": "Vault Key Ledger",
    "summary": "Restricted key material metadata.",
    "owner": "vault",
    "source": "roles/brain/data/entities/products.json",
    "last_verified_at": "2026-07-23T00:00:00Z",
    "classification": "restricted",
    "confidence": 0.51,
    "tags": ["security", "keys"],
    "related": [],
    "stale": false,
    "missing_fields": []
  }
]
